{
  "account": "dev",
  "topic": "Mods de Claude Code",
  "infoDate": "2026-10-16",
  "slides": [
    {
      "type": "cover",
      "kicker": "Nuevo desde el 1 de octubre",
      "title": "Ya puedes reprogramar Claude Code por dentro",
      "highlight": "por dentro",
      "terminal": ["$ claude", "> /plugin", "# instala o escribe tu primer mod"]
    },
    {
      "type": "concept",
      "eyebrow": "Qué es un mod",
      "title": "Una función TypeScript enganchada a un evento",
      "body": "Corre antes, después o en lugar de ese evento.",
      "flow": [
        { "label": "Evento", "note": "herramienta, permiso o pantalla" },
        { "label": "Tu mod", "note": "antes, después o en su lugar" },
        { "label": "Claude Code", "note": "CLI y app de escritorio" }
      ]
    },
    {
      "type": "list",
      "eyebrow": "Chuleta",
      "title": "6 cosas que puede hacer un mod",
      "items": [
        { "label": "Reescribir tu prompt", "detail": "antes de que lo lea el modelo" },
        { "label": "Bloquear o reintentar herramientas" },
        { "label": "Aprobar o negar permisos" },
        { "label": "Ocultar secretos", "detail": "en la salida de herramientas" },
        { "label": "Agregar botones y paneles" },
        { "label": "Reemplazar funciones nativas", "detail": "/diff ya es un mod" }
      ]
    },
    {
      "type": "list",
      "eyebrow": "Para tu equipo",
      "title": "3 ideas que propone Anthropic",
      "items": [
        { "label": "Estado del CI/CD", "detail": "en un panel lateral, sin salir de la terminal" },
        { "label": "Confirmación obligatoria", "detail": "antes de tocar la configuración de producción" },
        { "label": "Registro de auditoría", "detail": "de cada llamada a herramienta" }
      ]
    },
    {
      "type": "steps",
      "eyebrow": "Cómo empezar",
      "title": "Tres formas de entrar",
      "steps": [
        { "title": "Instala uno hecho", "detail": "desde el directorio de Claude o en la CLI con:", "code": "/plugin" },
        { "title": "Pídele a Claude que lo escriba", "detail": "lo escribe, lo instala y lo recarga en caliente" },
        { "title": "Compártelo", "detail": "empaquétalo en un plugin y súbelo al directorio" }
      ]
    },
    {
      "type": "closing",
      "eyebrow": "Antes de instalar",
      "title": "Los mods no están aislados",
      "warning": {
        "title": "Ojo",
        "text": "Tienen el mismo acceso a tu máquina que Claude Code. Instálalos solo de fuentes confiables."
      },
      "points": ["Si varios tocan un evento, corren en orden de carga"],
      "cta": { "save": "Guárdalo para tu primer mod", "question": "¿Cuál harías primero?" }
    }
  ],
  "caption": "Claude Code ahora se puede reprogramar por dentro con mods.\n\nAnthropic los anunció el 1 de octubre de 2026. Un mod es una función pequeña en TypeScript que se engancha a un evento: una llamada a herramienta, una solicitud de permiso o un cambio en pantalla. Corre antes, después o en lugar de ese evento.\n\nLo que puedes hacer con uno:\n1. Reescribir tu prompt antes de que lo lea el modelo.\n2. Bloquear, reescribir o reintentar llamadas a herramientas.\n3. Aprobar o negar permisos con tus reglas.\n4. Ocultar secretos en la salida.\n5. Agregar botones y paneles.\n6. Reemplazar funciones nativas: /diff ya es un mod.\n\nOjo: no están aislados. Tienen el mismo acceso a tu máquina que Claude Code, así que instala solo los de fuentes confiables.\n\n¿Qué mod harías primero? Guárdalo para cuando lo pruebes.\n\nInfo al 16 de octubre de 2026. Fuente: blog oficial de Claude.\n\n#claudecode #ia #programacion #desarrolladores #anthropic",
  "slideCaptions": [
    "Mods de Claude Code: anunciados el 1 de octubre de 2026.",
    "Un mod es una función en TypeScript que corre antes, después o en lugar de un evento.",
    "Seis cosas que puede hacer un mod, según el anuncio oficial.",
    "Ideas para equipos: CI/CD, confirmaciones y auditoría.",
    "Para empezar: /plugin, pedírselo a Claude o compartir el tuyo.",
    "No están aislados: instala solo mods de fuentes confiables."
  ],
  "sources": [
    {
      "title": "Customize Claude Code with mods (blog de Claude, 1 de octubre de 2026)",
      "url": "https://claude.com/blog/claude-code-mods",
      "checkedAt": "2026-10-16"
    }
  ]
}
